{
  "candidate_ids": [],
  "contract_id": "qra.part1-input",
  "contract_sha256": "9eaa0b8a3a2aa7e7d5c2b405f381234fb689f5e6327ab1e861389420f15fb197",
  "contract_version": "1.0.0",
  "created_at": "2026-08-26T10:00:00+08:00",
  "payload_sha256": "f9948915db0433ab38d37fb30b8c5a5d762d26fc536096fd0cdede9a9d15979f",
  "review_ids": [],
  "snapshot_id": "SNAP-SYNTHETIC-S00-D00-v1",
  "unresolved_issue_ids": []
}
