{
  "candidate_ids": [],
  "contract_id": "qra.part1-input",
  "contract_sha256": "9eaa0b8a3a2aa7e7d5c2b405f381234fb689f5e6327ab1e861389420f15fb197",
  "contract_version": "1.0.0",
  "created_at": "2026-08-26T10:00:00+08:00",
  "payload_sha256": "7f899cdd9797c17884dbc7a9e4a3b1516c07a61b2c3b8e95deea4b87e75d9a14",
  "review_ids": [],
  "snapshot_id": "SNAP-SYNTHETIC-S20-D00-v1",
  "unresolved_issue_ids": []
}
